{
  "schema_version": 1,
  "receipt_id": "bc7dddc4-7d65-4643-83bf-31394c087aee",
  "created_at_utc": "2026-04-28T16:03:38Z",
  "actor": {
    "kind": "script",
    "name": "mcp_manifest_admission.py"
  },
  "capability": {
    "id": "mcp_manifest_admission",
    "category": "policy",
    "output_lane": "work_artifact"
  },
  "authority": {
    "authority_surface": "prepared_context",
    "authority_class": "draftable",
    "gate_required_for_record_change": true
  },
  "declared_intent": "Offline admissions workflow — classify proposed GitHub read tooling versus Grace-Mar capability templates before any MCP wiring.",
  "inputs": {
    "operator_supplied_refs": [
      "examples/mcp-server-manifest.example.yaml"
    ]
  },
  "access": {
    "network_access": "none",
    "credential_use": "none",
    "resources_read": [
      "examples/mcp-server-manifest.example.yaml"
    ],
    "resources_written": [
      "artifacts/mcp-admission/_pytest_smoke.md"
    ]
  },
  "result": {
    "status": "success",
    "summary": "Generated MCP manifest admission packet.",
    "artifacts": [
      {
        "path": "artifacts/mcp-admission/_pytest_smoke.md",
        "kind": "markdown_mcp_manifest_admission"
      },
      {
        "path": "artifacts/mcp-receipts/bc7dddc4-7d65-4643-83bf-31394c087aee.json",
        "kind": "mcp_execution_receipt_json"
      }
    ]
  },
  "governance": {
    "durable_state_write_attempted": false,
    "canonical_record_touched": false,
    "requires_human_review": true,
    "requires_gate_review": true,
    "prohibited_action_attempted": false,
    "prohibited_action_notes": []
  },
  "integrity": {
    "repo_git_ref": "051fad36"
  }
}
